<?xml version="1.0" encoding="UTF-8"?>
<!-- edited with XMLSpy v2006 rel. 3 sp1 (http://www.altova.com) by Adrian Lapierre (SoftProject) -->
<xs:schema xmlns:xs="http://www.w3.org/2001/XMLSchema" xmlns="http://www.softproject.com.pl/commons/model/invoice" targetNamespace="http://www.softproject.com.pl/commons/model/invoice">
	<xs:element name="invoice">
		<xs:annotation>
			<xs:documentation>Główny element dokumentu</xs:documentation>
		</xs:annotation>
		<xs:complexType>
			<xs:sequence>
				<xs:element name="seller" type="xs:string">
					<xs:annotation>
						<xs:documentation>Dane sprzedawcy</xs:documentation>
					</xs:annotation>
				</xs:element>
				<xs:element name="buyer" type="xs:string">
					<xs:annotation>
						<xs:documentation>Dane nabywcy</xs:documentation>
					</xs:annotation>
				</xs:element>
				<xs:element name="place-of-issue" type="xs:string">
					<xs:annotation>
						<xs:documentation>miejsce wystawienia faktury</xs:documentation>
					</xs:annotation>
				</xs:element>
				<xs:element name="issue-date" type="xs:date">
					<xs:annotation>
						<xs:documentation>data wystawienia faktury</xs:documentation>
					</xs:annotation>
				</xs:element>
				<xs:element name="sell-date" type="xs:date">
					<xs:annotation>
						<xs:documentation>data wykonania usługi / dostarczenia towaru</xs:documentation>
					</xs:annotation>
				</xs:element>
				<xs:element name="invoice-number" type="xs:string">
					<xs:annotation>
						<xs:documentation>numer faktury</xs:documentation>
					</xs:annotation>
				</xs:element>
				<xs:element name="items">
					<xs:annotation>
						<xs:documentation>pozycje faktury</xs:documentation>
					</xs:annotation>
					<xs:complexType>
						<xs:sequence>
							<xs:element name="item" maxOccurs="unbounded">
								<xs:complexType>
									<xs:sequence>
										<xs:element name="no" type="xs:int">
											<xs:annotation>
												<xs:documentation>lp na dokumencie</xs:documentation>
											</xs:annotation>
										</xs:element>
										<xs:element name="code" type="xs:string">
											<xs:annotation>
												<xs:documentation>kod produktu</xs:documentation>
											</xs:annotation>
										</xs:element>
										<xs:element name="name" type="xs:string">
											<xs:annotation>
												<xs:documentation>nazwa produktu</xs:documentation>
											</xs:annotation>
										</xs:element>
										<xs:element name="foreign-name" type="xs:string" minOccurs="0">
											<xs:annotation>
												<xs:documentation>nazwa produtku w jęcyku obcym</xs:documentation>
											</xs:annotation>
										</xs:element>
										<xs:element name="qty" type="xs:double">
											<xs:annotation>
												<xs:documentation>ilość sztuk produktu</xs:documentation>
											</xs:annotation>
										</xs:element>
										<xs:element name="unit-name" type="xs:string">
											<xs:annotation>
												<xs:documentation>jednostka miary produktu</xs:documentation>
											</xs:annotation>
										</xs:element>
										<xs:element name="foreign-unit-name" type="xs:string" minOccurs="0">
											<xs:annotation>
												<xs:documentation>jednostka miary w języku obcym</xs:documentation>
											</xs:annotation>
										</xs:element>
										<xs:element name="currency" type="currencyType">
											<xs:annotation>
												<xs:documentation>waluta w języku dokumentu</xs:documentation>
											</xs:annotation>
										</xs:element>
										<xs:element name="foreign-curency" type="currencyType" minOccurs="0">
											<xs:annotation>
												<xs:documentation>waluta kraju dostawy</xs:documentation>
											</xs:annotation>
										</xs:element>
										<xs:element name="net-value" type="xs:double">
											<xs:annotation>
												<xs:documentation>wartość netto w walicie dokumentu</xs:documentation>
											</xs:annotation>
										</xs:element>
										<xs:element name="foreign-net-value" type="xs:double" minOccurs="0">
											<xs:annotation>
												<xs:documentation>wartość netto w walucie obcej</xs:documentation>
											</xs:annotation>
										</xs:element>
										<xs:element name="vat-rate" type="xs:double">
											<xs:annotation>
												<xs:documentation>wartość podatku w kraju wystwienia dokumentu</xs:documentation>
											</xs:annotation>
										</xs:element>
										<xs:element name="net-amount" type="xs:double">
											<xs:annotation>
												<xs:documentation>kwota netto (ilość razy wartość) w walicie dokumentu</xs:documentation>
											</xs:annotation>
										</xs:element>
										<xs:element name="foreign-net-amount" type="xs:double" minOccurs="0">
											<xs:annotation>
												<xs:documentation>kwota netto w walucie obcej</xs:documentation>
											</xs:annotation>
										</xs:element>
										<xs:element name="vat-amount" type="xs:double">
											<xs:annotation>
												<xs:documentation>wartość podatku VAT w kraju wystawienia faktury</xs:documentation>
											</xs:annotation>
										</xs:element>
										<xs:element name="gross-amount" type="xs:double">
											<xs:annotation>
												<xs:documentation>wartość brutto w walucie dokumentu</xs:documentation>
											</xs:annotation>
										</xs:element>
										<xs:element name="foreign-gross-amount" type="xs:double" minOccurs="0">
											<xs:annotation>
												<xs:documentation>wartość brutto w walucie obcej</xs:documentation>
											</xs:annotation>
										</xs:element>
										<xs:element name="weight" type="xs:double" minOccurs="0">
											<xs:annotation>
												<xs:documentation>waga</xs:documentation>
											</xs:annotation>
										</xs:element>
										<xs:element name="item-group-name" type="xs:string" minOccurs="0">
											<xs:annotation>
												<xs:documentation>nazwa grupy produtków - zastosowanie do generowania zestawienia sprzedaży</xs:documentation>
											</xs:annotation>
										</xs:element>
										<xs:element name="item-group-id" type="xs:int" minOccurs="0">
											<xs:annotation>
												<xs:documentation>identyfiator grupy produtków - zastosowanie do generowania zestawienia sprzedaży</xs:documentation>
											</xs:annotation>
										</xs:element>
										<xs:element name="foreign-vat-amount" type="xs:double" minOccurs="0">
											<xs:annotation>
												<xs:documentation>wartość podatku VAT w kraju dostawy</xs:documentation>
											</xs:annotation>
										</xs:element>
									</xs:sequence>
								</xs:complexType>
							</xs:element>
						</xs:sequence>
					</xs:complexType>
				</xs:element>
				<xs:element name="summary">
					<xs:annotation>
						<xs:documentation>podsumowanie dokumentu</xs:documentation>
					</xs:annotation>
					<xs:complexType>
						<xs:sequence>
							<xs:element name="total-amount" type="xs:double">
								<xs:annotation>
									<xs:documentation>całkowita wartość faktury brutto</xs:documentation>
								</xs:annotation>
							</xs:element>
							<xs:element name="currency" type="currencyType">
								<xs:annotation>
									<xs:documentation>waluta dokument</xs:documentation>
								</xs:annotation>
							</xs:element>
							<xs:element name="foreign-currency" type="currencyType" minOccurs="0">
								<xs:annotation>
									<xs:documentation>waluta obca</xs:documentation>
								</xs:annotation>
							</xs:element>
							<xs:element name="currency-rate" type="xs:double" minOccurs="0">
								<xs:annotation>
									<xs:documentation>zastosowany kurs waluty</xs:documentation>
								</xs:annotation>
							</xs:element>
							<xs:element name="total-amount-in-words" type="xs:string">
								<xs:annotation>
									<xs:documentation>wartość faktury słownie w języku dokumentu</xs:documentation>
								</xs:annotation>
							</xs:element>
							<xs:element name="left-to-pay" type="xs:double">
								<xs:annotation>
									<xs:documentation>pozostało do zapłaty</xs:documentation>
								</xs:annotation>
							</xs:element>
							<xs:element name="payment-date" type="xs:date">
								<xs:annotation>
									<xs:documentation>data płatności</xs:documentation>
								</xs:annotation>
							</xs:element>
							<xs:element name="days-to-pay" type="xs:int">
								<xs:annotation>
									<xs:documentation>termin zapłaty</xs:documentation>
								</xs:annotation>
							</xs:element>
							<xs:element name="signer" type="xs:string">
								<xs:annotation>
									<xs:documentation>podpis osoby wystawiającej fakturę</xs:documentation>
								</xs:annotation>
							</xs:element>
							<xs:element name="net-value" type="xs:double">
								<xs:annotation>
									<xs:documentation>całkowita wartośc netto w walucie dokuemntu </xs:documentation>
								</xs:annotation>
							</xs:element>
							<xs:element name="foreign-net-value" type="xs:double" minOccurs="0">
								<xs:annotation>
									<xs:documentation>całkowita wartość netto w walucie obcej</xs:documentation>
								</xs:annotation>
							</xs:element>
							<xs:element name="tax-value" type="xs:double">
								<xs:annotation>
									<xs:documentation>wartość podatku w kraju</xs:documentation>
								</xs:annotation>
							</xs:element>
							<xs:element name="foreign-tax-value" type="xs:double" minOccurs="0">
								<xs:annotation>
									<xs:documentation>wartośc podatku za granicą</xs:documentation>
								</xs:annotation>
							</xs:element>
							<xs:element name="gross-value" type="xs:double">
								<xs:annotation>
									<xs:documentation>wartość do zapłaty</xs:documentation>
								</xs:annotation>
							</xs:element>
							<xs:element name="foreign-gross-value" type="xs:double" minOccurs="0">
								<xs:annotation>
									<xs:documentation>wartość do zapąty w walucie obcej</xs:documentation>
								</xs:annotation>
							</xs:element>
							<xs:element name="tax-rate" type="xs:double" minOccurs="0">
								<xs:annotation>
									<xs:documentation>stawka podatku</xs:documentation>
								</xs:annotation>
							</xs:element>
						</xs:sequence>
					</xs:complexType>
				</xs:element>
				<xs:element name="grouping" minOccurs="0">
					<xs:annotation>
						<xs:documentation>grupowania, które należy zastosować w dokumecie zestawienie sprzedaży</xs:documentation>
					</xs:annotation>
					<xs:complexType>
						<xs:sequence>
							<xs:element name="item-group" maxOccurs="unbounded">
								<xs:complexType>
									<xs:attribute name="id" type="xs:int" use="required">
										<xs:annotation>
											<xs:documentation>id grupy towarów</xs:documentation>
										</xs:annotation>
									</xs:attribute>
									<xs:attribute name="name" type="xs:string" use="required">
										<xs:annotation>
											<xs:documentation>nazwa grupy towatów</xs:documentation>
										</xs:annotation>
									</xs:attribute>
									<xs:attribute name="qty" type="xs:double" use="required">
										<xs:annotation>
											<xs:documentation>zagregowana iliść</xs:documentation>
										</xs:annotation>
									</xs:attribute>
									<xs:attribute name="unit-name" type="xs:string" use="required">
										<xs:annotation>
											<xs:documentation>nazwa jednostki</xs:documentation>
										</xs:annotation>
									</xs:attribute>
									<xs:attribute name="weight" type="xs:double" use="required">
										<xs:annotation>
											<xs:documentation>waga</xs:documentation>
										</xs:annotation>
									</xs:attribute>
									<xs:attribute name="currency" type="xs:string" use="required">
										<xs:annotation>
											<xs:documentation>waluta</xs:documentation>
										</xs:annotation>
									</xs:attribute>
									<xs:attribute name="net-amount" type="xs:double" use="required">
										<xs:annotation>
											<xs:documentation>wartość netto</xs:documentation>
										</xs:annotation>
									</xs:attribute>
									<xs:attribute name="vat-rate" type="xs:double" use="required">
										<xs:annotation>
											<xs:documentation>stawka VAT</xs:documentation>
										</xs:annotation>
									</xs:attribute>
									<xs:attribute name="gross-amount" type="xs:double" use="required">
										<xs:annotation>
											<xs:documentation>wartość brutto</xs:documentation>
										</xs:annotation>
									</xs:attribute>
									<xs:attribute name="no" type="xs:int">
										<xs:annotation>
											<xs:documentation>lp na dokumencie zestawienia</xs:documentation>
										</xs:annotation>
									</xs:attribute>
								</xs:complexType>
							</xs:element>
						</xs:sequence>
					</xs:complexType>
				</xs:element>
			</xs:sequence>
		</xs:complexType>
	</xs:element>
	<xs:simpleType name="currencyType">
		<xs:restriction base="xs:string">
			<xs:enumeration value="EUR"/>
			<xs:enumeration value="PLN"/>
			<xs:enumeration value="USD"/>
			<xs:enumeration value="GBP"/>
		</xs:restriction>
	</xs:simpleType>
</xs:schema>